{
  "$schema": "https://json-schema.org/draft/2020-12/schema",
  "$id": "https://pwfabric.com/spec/schemas/connector-manifest.schema.json",
  "title": "Connector atom manifest",
  "description": "The manifest of a connector or provider atom: its connection name, configuration fields, delegated scopes and engine declaration. Generated from the reference schema AtomFileManifestSchema (kind \"connector\" or \"provider\"); do not edit by hand.",
  "type": "object",
  "properties": {
    "id": {
      "type": "string",
      "minLength": 1
    },
    "kind": {
      "enum": [
        "connector",
        "provider"
      ]
    },
    "version": {
      "type": "string",
      "minLength": 1
    },
    "name": {
      "type": "string",
      "minLength": 1
    },
    "state": {
      "type": "string",
      "enum": [
        "stable",
        "beta",
        "alpha",
        "deprecated",
        "experimental"
      ]
    },
    "category": {
      "type": "string"
    },
    "description": {
      "type": "string"
    },
    "tags": {
      "type": "array",
      "items": {
        "type": "string"
      }
    },
    "knowledge": {
      "type": "object",
      "properties": {
        "purpose": {
          "type": "string",
          "minLength": 1
        },
        "useCases": {
          "type": "array",
          "items": {
            "type": "string",
            "minLength": 1
          },
          "minItems": 1
        },
        "composesWith": {
          "type": "array",
          "items": {
            "type": "string",
            "minLength": 1
          }
        },
        "antiPatterns": {
          "type": "array",
          "items": {
            "type": "string",
            "minLength": 1
          },
          "minItems": 1
        },
        "implementation": {
          "type": "string"
        }
      },
      "required": [
        "purpose",
        "useCases",
        "composesWith",
        "antiPatterns"
      ],
      "additionalProperties": false
    },
    "definition": {
      "type": "object",
      "properties": {
        "props": {
          "type": "array",
          "items": {
            "type": "object",
            "additionalProperties": {}
          }
        },
        "defaultProps": {
          "type": "object",
          "additionalProperties": {}
        },
        "canHaveChildren": {
          "type": "boolean"
        },
        "allowedParents": {
          "type": "array",
          "items": {
            "type": "string",
            "minLength": 1
          }
        },
        "icon": {
          "type": "string"
        },
        "traits": {
          "type": "array",
          "items": {
            "type": "string",
            "pattern": "^[a-z][a-z0-9-]*$"
          }
        },
        "allowedChildTraits": {
          "type": "array",
          "items": {
            "type": "string",
            "pattern": "^[a-z][a-z0-9-]*$"
          }
        }
      },
      "required": [
        "props",
        "defaultProps",
        "canHaveChildren"
      ],
      "additionalProperties": false
    },
    "config": {
      "type": "object",
      "properties": {
        "fields": {
          "type": "array",
          "items": {
            "type": "object",
            "properties": {
              "key": {
                "type": "string",
                "minLength": 1
              },
              "type": {
                "type": "string",
                "enum": [
                  "string",
                  "number",
                  "boolean",
                  "select",
                  "multi-select",
                  "url",
                  "email",
                  "json"
                ]
              },
              "required": {
                "type": "boolean"
              },
              "defaultValue": {},
              "label": {
                "type": "string",
                "minLength": 1
              },
              "description": {
                "type": "string"
              },
              "group": {
                "type": "string"
              },
              "order": {
                "type": "number"
              },
              "sensitive": {
                "type": "boolean"
              },
              "options": {
                "type": "array",
                "items": {
                  "type": "object",
                  "properties": {
                    "value": {
                      "type": "string"
                    },
                    "label": {
                      "type": "string"
                    },
                    "description": {
                      "type": "string"
                    }
                  },
                  "required": [
                    "value",
                    "label"
                  ],
                  "additionalProperties": false
                }
              },
              "constraints": {
                "type": "object",
                "properties": {
                  "min": {
                    "type": "number"
                  },
                  "max": {
                    "type": "number"
                  },
                  "pattern": {
                    "type": "string"
                  },
                  "patternMessage": {
                    "type": "string"
                  }
                },
                "additionalProperties": false
              }
            },
            "required": [
              "key",
              "type",
              "required",
              "label"
            ],
            "additionalProperties": false
          }
        }
      },
      "required": [
        "fields"
      ],
      "additionalProperties": false
    },
    "theme": {
      "type": "object",
      "properties": {
        "colors": {
          "type": "object",
          "additionalProperties": {
            "type": "string"
          }
        },
        "border": {
          "type": "object",
          "properties": {
            "radius": {
              "type": "string"
            },
            "width": {
              "type": "string"
            },
            "style": {
              "type": "string"
            },
            "radiusLarge": {
              "type": "string"
            }
          },
          "additionalProperties": true
        },
        "typography": {
          "type": "object",
          "properties": {
            "fontFamily": {
              "type": "string"
            },
            "headingFontFamily": {
              "type": "string"
            },
            "baseFontSize": {
              "type": "string"
            },
            "headingWeight": {
              "type": "string"
            },
            "headingLineHeight": {
              "type": "string"
            },
            "letterSpacing": {
              "type": "string"
            },
            "bodyLineHeight": {
              "type": "string"
            },
            "fontSizeSm": {
              "type": "string"
            },
            "fontSizeXs": {
              "type": "string"
            }
          },
          "additionalProperties": true
        },
        "spacing": {
          "type": "object",
          "properties": {
            "base": {
              "type": "string"
            }
          },
          "additionalProperties": true
        },
        "layout": {
          "type": "object",
          "properties": {
            "gap": {
              "type": "string"
            },
            "padding": {
              "type": "string"
            },
            "containerMaxWidth": {
              "type": "string"
            },
            "gridGap": {
              "type": "string"
            }
          },
          "additionalProperties": true
        },
        "shadows": {
          "type": "object",
          "properties": {
            "card": {
              "type": "string"
            },
            "button": {
              "type": "string"
            }
          },
          "additionalProperties": true
        },
        "motion": {
          "type": "object",
          "properties": {
            "durationFast": {
              "type": "string"
            },
            "durationNormal": {
              "type": "string"
            },
            "durationSlow": {
              "type": "string"
            },
            "easing": {
              "type": "string"
            },
            "easingBounce": {
              "type": "string"
            }
          },
          "additionalProperties": true
        }
      },
      "additionalProperties": true
    },
    "connection": {
      "type": "string",
      "minLength": 1
    },
    "configSchema": {
      "type": "object",
      "properties": {
        "fields": {
          "type": "array",
          "items": {
            "type": "object",
            "properties": {
              "key": {
                "type": "string",
                "minLength": 1
              },
              "type": {
                "type": "string",
                "enum": [
                  "string",
                  "number",
                  "boolean",
                  "select",
                  "multi-select",
                  "url",
                  "email",
                  "json"
                ]
              },
              "required": {
                "type": "boolean"
              },
              "defaultValue": {},
              "label": {
                "type": "string",
                "minLength": 1
              },
              "description": {
                "type": "string"
              },
              "group": {
                "type": "string"
              },
              "order": {
                "type": "number"
              },
              "sensitive": {
                "type": "boolean"
              },
              "options": {
                "type": "array",
                "items": {
                  "type": "object",
                  "properties": {
                    "value": {
                      "type": "string"
                    },
                    "label": {
                      "type": "string"
                    },
                    "description": {
                      "type": "string"
                    }
                  },
                  "required": [
                    "value",
                    "label"
                  ],
                  "additionalProperties": false
                }
              },
              "constraints": {
                "type": "object",
                "properties": {
                  "min": {
                    "type": "number"
                  },
                  "max": {
                    "type": "number"
                  },
                  "pattern": {
                    "type": "string"
                  },
                  "patternMessage": {
                    "type": "string"
                  }
                },
                "additionalProperties": false
              }
            },
            "required": [
              "key",
              "type",
              "required",
              "label"
            ],
            "additionalProperties": false
          }
        }
      },
      "required": [
        "fields"
      ],
      "additionalProperties": false
    },
    "scopes": {
      "type": "array",
      "items": {
        "type": "object",
        "properties": {
          "name": {
            "type": "string",
            "minLength": 1
          },
          "adminConsent": {
            "type": "boolean"
          },
          "reason": {
            "type": "string"
          }
        },
        "required": [
          "name"
        ],
        "additionalProperties": false
      }
    },
    "engine": {
      "type": "object",
      "properties": {
        "host": {
          "type": "string",
          "minLength": 1
        },
        "resolve": {
          "type": "object",
          "properties": {
            "path": {
              "type": "string",
              "minLength": 1
            },
            "field": {
              "type": "string",
              "minLength": 1
            },
            "as": {
              "type": "string",
              "minLength": 1
            }
          },
          "required": [
            "path",
            "field",
            "as"
          ],
          "additionalProperties": false
        },
        "path": {
          "type": "string",
          "minLength": 1
        },
        "params": {
          "type": "object",
          "additionalProperties": {
            "type": "string"
          }
        },
        "auth": {
          "type": "object",
          "properties": {
            "type": {
              "type": "string",
              "enum": [
                "bearer",
                "api-key",
                "basic",
                "none"
              ]
            }
          },
          "required": [
            "type"
          ],
          "additionalProperties": false
        },
        "read": {
          "type": "object",
          "properties": {
            "items": {
              "type": "string",
              "minLength": 1
            },
            "id": {
              "type": "string",
              "minLength": 1
            },
            "flatten": {
              "type": "string",
              "minLength": 1
            },
            "lift": {
              "type": "array",
              "items": {
                "type": "string",
                "minLength": 1
              }
            }
          },
          "required": [
            "items",
            "id"
          ],
          "additionalProperties": false
        },
        "write": {
          "type": "object",
          "properties": {
            "bodyWrap": {
              "type": "string",
              "minLength": 1
            }
          },
          "additionalProperties": false
        },
        "transforms": {
          "type": "array",
          "items": {
            "type": "object",
            "properties": {
              "field": {
                "type": "string",
                "minLength": 1
              },
              "use": {
                "type": "string",
                "minLength": 1
              }
            },
            "required": [
              "field",
              "use"
            ],
            "additionalProperties": false
          }
        }
      },
      "required": [
        "host",
        "path",
        "auth",
        "read"
      ],
      "additionalProperties": false
    },
    "forkedFrom": {
      "type": "object",
      "properties": {
        "pack": {
          "type": "string",
          "minLength": 1
        },
        "version": {
          "type": "string",
          "minLength": 1
        },
        "atomId": {
          "type": "string",
          "minLength": 1
        },
        "hash": {
          "type": "string",
          "minLength": 1
        }
      },
      "required": [
        "pack",
        "version",
        "atomId",
        "hash"
      ],
      "additionalProperties": false
    }
  },
  "required": [
    "id",
    "kind",
    "version",
    "name",
    "state",
    "knowledge"
  ],
  "additionalProperties": false
}
